{"protocol":1,"summary":{"title":"Tudo","blocks":[{"type":"lines","lines":[{"text":"resumo"}]},{"type":"rows","rows":[{"time":"09:00","text":"Daily"}]},{"type":"stat","items":[{"value":"1","label":"item"}]},{"type":"table","columns":[{"title":"A"}],"rows":[["x"]]}]},"detail":{"sections":[{"heading":"Seção","blocks":[{"type":"lines","lines":[{"text":"contexto"}]}],"items":[{"id":"a","text":"Item A","meta":{"chave":"valor"}}]}]},"actions":[{"id":"refresh","label":"Atualizar"}]}
